number,value,datetime_start,datetime_complete,duration,params_filters_0,params_filters_1,params_filters_2,params_filters_3,params_n_conv_layers,params_padding_0,params_padding_1,params_padding_2,params_padding_3,params_pool_0,params_pool_1,params_pool_2,params_pool_3,user_attrs_macs,user_attrs_macs_ratio,user_attrs_val_accuracy,system_attrs_tpe:relative_params:0,state
67,0.5474145084628476,2026-09-16 14:36:35.353236,2026-09-16 14:36:53.519521,0 days 00:00:18.166285,24,48,32.0,,3,same,valid,valid,,2,2,1.0,,3429808.0,0.06062876432014911,0.5522648096084595,"{""filters_0"": 24, ""filters_1"": 48, ""n_conv_layers"": 3, ""padding_0"": ""same"", ""padding_1"": ""valid"", ""pool_0"": 2, ""pool_1"": 2}",COMPLETE
68,0.850177322149242,2026-09-16 14:36:53.520650,2026-09-16 14:37:32.561968,0 days 00:00:39.041318,16,24,32.0,,3,same,valid,valid,,2,1,1.0,,2461696.0,0.04351543486161726,0.8536585569381714,"{""filters_0"": 16, ""filters_1"": 24, ""n_conv_layers"": 3, ""padding_0"": ""same"", ""padding_1"": ""valid"", ""pool_0"": 2, ""pool_1"": 1}",COMPLETE
69,,2026-09-16 14:37:32.562549,2026-09-16 14:37:32.629257,0 days 00:00:00.066708,24,48,32.0,32.0,4,same,same,valid,same,2,1,4.0,4.0,,,,"{""filters_0"": 24, ""filters_1"": 48, ""n_conv_layers"": 4, ""padding_0"": ""same"", ""padding_1"": ""same"", ""pool_0"": 2, ""pool_1"": 1}",PRUNED
70,0.8327614131513302,2026-09-16 14:37:32.629669,2026-09-16 14:38:33.977753,0 days 00:01:01.348084,16,24,24.0,,3,same,valid,valid,,1,2,1.0,,5537496.0,0.09788639478004844,0.8405923247337341,"{""filters_0"": 16, ""filters_1"": 24, ""n_conv_layers"": 3, ""padding_0"": ""same"", ""padding_1"": ""valid"", ""pool_0"": 1, ""pool_1"": 2}",COMPLETE
71,0.9121602302641598,2026-09-16 14:38:33.979662,2026-09-16 14:39:23.839625,0 days 00:00:49.859963,24,24,16.0,32.0,4,same,same,valid,same,2,2,1.0,1.0,2365360.0,0.04181250203285662,0.9155052304267883,"{""filters_0"": 24, ""filters_1"": 24, ""n_conv_layers"": 4, ""padding_0"": ""same"", ""padding_1"": ""same"", ""pool_0"": 2, ""pool_1"": 2}",COMPLETE
72,0.7963869088585749,2026-09-16 14:39:23.841953,2026-09-16 14:39:56.899071,0 days 00:00:33.057118,16,24,,,2,same,same,,,4,2,,,460632.0,0.00814259835137096,0.7970383167266846,"{""filters_0"": 16, ""filters_1"": 24, ""n_conv_layers"": 2, ""padding_0"": ""same"", ""padding_1"": ""same"", ""pool_0"": 4, ""pool_1"": 2}",COMPLETE
73,0.8886410719008175,2026-09-16 14:39:56.899678,2026-09-16 14:40:54.382861,0 days 00:00:57.483183,24,24,16.0,32.0,4,same,same,valid,same,2,2,1.0,1.0,2365360.0,0.04181250203285662,0.891986072063446,"{""filters_0"": 24, ""filters_1"": 24, ""n_conv_layers"": 4, ""padding_0"": ""same"", ""padding_1"": ""same"", ""pool_0"": 2, ""pool_1"": 2}",COMPLETE
74,0.8725701012980285,2026-09-16 14:40:54.384832,2026-09-16 14:41:44.880133,0 days 00:00:50.495301,16,48,16.0,32.0,4,same,valid,valid,same,2,4,1.0,1.0,2026240.0,0.03581787301681579,0.8754355311393738,"{""filters_0"": 16, ""filters_1"": 48, ""n_conv_layers"": 4, ""padding_0"": ""same"", ""padding_1"": ""valid"", ""pool_0"": 2, ""pool_1"": 4}",COMPLETE
75,0.8869278202275339,2026-09-16 14:41:44.882383,2026-09-16 14:42:31.486562,0 days 00:00:46.604179,16,32,16.0,,3,same,same,valid,,2,4,1.0,,1728944.0,0.03056256743780873,0.8893728256225586,"{""filters_0"": 16, ""filters_1"": 32, ""n_conv_layers"": 3, ""padding_0"": ""same"", ""padding_1"": ""same"", ""pool_0"": 2, ""pool_1"": 4}",COMPLETE
76,0.17728407648980737,2026-09-16 14:42:31.488831,2026-09-16 14:42:58.586726,0 days 00:00:27.097895,48,24,32.0,32.0,4,same,same,valid,same,1,2,1.0,1.0,18773440.0,0.3318583632781952,0.203832745552063,"{""filters_0"": 48, ""filters_1"": 24, ""n_conv_layers"": 4, ""padding_0"": ""same"", ""padding_1"": ""same"", ""pool_0"": 1, ""pool_1"": 2}",COMPLETE
77,,2026-09-16 14:42:58.587447,2026-09-16 14:42:58.662769,0 days 00:00:00.075322,24,24,16.0,32.0,4,valid,same,valid,same,2,4,1.0,4.0,,,,"{""filters_0"": 24, ""filters_1"": 24, ""n_conv_layers"": 4, ""padding_0"": ""valid"", ""padding_1"": ""same"", ""pool_0"": 2, ""pool_1"": 4}",PRUNED
78,0.8928511110178834,2026-09-16 14:42:58.663261,2026-09-16 14:43:53.290899,0 days 00:00:54.627638,24,32,32.0,16.0,4,same,same,valid,valid,2,2,1.0,1.0,3084128.0,0.05451817409171966,0.897212564945221,"{""filters_0"": 24, ""filters_1"": 32, ""n_conv_layers"": 4, ""padding_0"": ""same"", ""padding_1"": ""same"", ""pool_0"": 2, ""pool_1"": 2}",COMPLETE
79,0.7682760769159676,2026-09-16 14:43:53.292871,2026-09-16 14:44:40.564445,0 days 00:00:47.271574,16,48,,,2,same,same,,,2,2,,,2475600.0,0.043761216065436065,0.7717769742012024,"{""filters_0"": 16, ""filters_1"": 48, ""n_conv_layers"": 2, ""padding_0"": ""same"", ""padding_1"": ""same"", ""pool_0"": 2, ""pool_1"": 2}",COMPLETE
80,0.8847904085635918,2026-09-16 14:44:40.566490,2026-09-16 14:46:03.342856,0 days 00:01:22.776366,48,48,32.0,24.0,4,valid,valid,valid,valid,2,2,1.0,1.0,5704248.0,0.10083407223252203,0.8928571343421936,"{""filters_0"": 48, ""filters_1"": 48, ""n_conv_layers"": 4, ""padding_0"": ""valid"", ""padding_1"": ""valid"", ""pool_0"": 2, ""pool_1"": 2}",COMPLETE
81,0.883790322969122,2026-09-16 14:46:03.344885,2026-09-16 14:47:22.569819,0 days 00:01:19.224934,16,48,24.0,24.0,4,same,same,same,same,1,4,1.0,4.0,10723224.0,0.1895545816699263,0.8989546895027161,"{""filters_0"": 16, ""filters_1"": 48, ""n_conv_layers"": 4, ""padding_0"": ""same"", ""padding_1"": ""same"", ""pool_0"": 1, ""pool_1"": 4}",COMPLETE
82,0.8807124904444746,2026-09-16 14:47:22.571806,2026-09-16 14:48:16.068965,0 days 00:00:53.497159,24,48,32.0,,3,valid,same,same,,2,2,1.0,,4276096.0,0.07558860921495673,0.8867595791816711,"{""filters_0"": 24, ""filters_1"": 48, ""n_conv_layers"": 3, ""padding_0"": ""valid"", ""padding_1"": ""same"", ""pool_0"": 2, ""pool_1"": 2}",COMPLETE
83,0.8770775441566819,2026-09-16 14:48:16.070092,2026-09-16 14:49:03.498713,0 days 00:00:47.428621,24,24,32.0,,3,same,same,same,,2,2,4.0,,2534704.0,0.04480599830583497,0.8806620240211487,"{""filters_0"": 24, ""filters_1"": 24, ""n_conv_layers"": 3, ""padding_0"": ""same"", ""padding_1"": ""same"", ""pool_0"": 2, ""pool_1"": 2}",COMPLETE
84,0.8831133569195598,2026-09-16 14:49:03.499351,2026-09-16 14:50:13.022991,0 days 00:01:09.523640,48,24,16.0,,3,valid,same,same,,2,2,1.0,,3810320.0,0.06735508030313958,0.888501763343811,"{""filters_0"": 48, ""filters_1"": 24, ""n_conv_layers"": 3, ""padding_0"": ""valid"", ""padding_1"": ""same"", ""pool_0"": 2, ""pool_1"": 2}",COMPLETE
85,0.8819206298556322,2026-09-16 14:50:13.024138,2026-09-16 14:51:58.521725,0 days 00:01:45.497587,32,32,32.0,48.0,4,same,same,valid,same,1,2,1.0,1.0,18821040.0,0.332699789148576,0.9085366129875183,"{""filters_0"": 32, ""filters_1"": 32, ""n_conv_layers"": 4, ""padding_0"": ""same"", ""padding_1"": ""same"", ""pool_0"": 1, ""pool_1"": 2}",COMPLETE
86,0.4462772451944147,2026-09-16 14:51:58.522815,2026-09-16 14:52:16.871508,0 days 00:00:18.348693,48,48,48.0,16.0,4,same,same,valid,same,4,2,1.0,1.0,2262896.0,0.040001244461791485,0.44947734475135803,"{""filters_0"": 48, ""filters_1"": 48, ""n_conv_layers"": 4, ""padding_0"": ""same"", ""padding_1"": ""same"", ""pool_0"": 4, ""pool_1"": 2}",COMPLETE
87,0.8892861034827723,2026-09-16 14:52:16.872095,2026-09-16 14:52:50.257863,0 days 00:00:33.385768,16,24,32.0,,3,valid,same,same,,2,4,1.0,,1293280.0,0.02286132877407786,0.8911150097846985,"{""filters_0"": 16, ""filters_1"": 24, ""n_conv_layers"": 3, ""padding_0"": ""valid"", ""padding_1"": ""same"", ""pool_0"": 2, ""pool_1"": 4}",COMPLETE
88,0.254154169170058,2026-09-16 14:52:50.258369,2026-09-16 14:53:14.795450,0 days 00:00:24.537081,48,32,24.0,32.0,4,same,valid,valid,same,2,2,2.0,1.0,4454080.0,0.07873483488961765,0.2604529559612274,"{""filters_0"": 48, ""filters_1"": 32, ""n_conv_layers"": 4, ""padding_0"": ""same"", ""padding_1"": ""valid"", ""pool_0"": 2, ""pool_1"": 2}",COMPLETE
89,0.4266541471132033,2026-09-16 14:53:14.796520,2026-09-16 14:53:26.851689,0 days 00:00:12.055169,16,16,32.0,32.0,4,same,same,valid,valid,2,2,1.0,2.0,1355776.0,0.023966071446248443,0.4285714328289032,"{""filters_0"": 16, ""filters_1"": 16, ""n_conv_layers"": 4, ""padding_0"": ""same"", ""padding_1"": ""same"", ""pool_0"": 2, ""pool_1"": 2}",COMPLETE
90,0.4480700491491458,2026-09-16 14:53:26.852199,2026-09-16 14:53:46.661862,0 days 00:00:19.809663,24,16,48.0,24.0,4,same,valid,same,same,2,2,1.0,1.0,2227080.0,0.039368124525372174,0.45121949911117554,"{""filters_0"": 24, ""filters_1"": 16, ""n_conv_layers"": 4, ""padding_0"": ""same"", ""padding_1"": ""valid"", ""pool_0"": 2, ""pool_1"": 2}",COMPLETE
91,0.3008602109778811,2026-09-16 14:53:46.663524,2026-09-16 14:53:57.784142,0 days 00:00:11.120618,16,24,32.0,32.0,4,same,valid,valid,same,2,2,1.0,1.0,1609216.0,0.028446133895603798,0.3031359016895294,"{""filters_0"": 16, ""filters_1"": 24, ""n_conv_layers"": 4, ""padding_0"": ""same"", ""padding_1"": ""valid"", ""pool_0"": 2, ""pool_1"": 2}",COMPLETE
92,0.3709417258107627,2026-09-16 14:53:57.785109,2026-09-16 14:54:14.230509,0 days 00:00:16.445400,32,32,32.0,32.0,4,valid,same,valid,same,2,2,1.0,1.0,3793696.0,0.0670612176210133,0.3763066232204437,"{""filters_0"": 32, ""filters_1"": 32, ""n_conv_layers"": 4, ""padding_0"": ""valid"", ""padding_1"": ""same"", ""pool_0"": 2, ""pool_1"": 2}",COMPLETE
93,,2026-09-16 14:54:14.231064,2026-09-16 14:54:14.273211,0 days 00:00:00.042147,48,24,32.0,,4,same,valid,valid,,4,2,,,,,,"{""filters_0"": 48, ""filters_1"": 24, ""n_conv_layers"": 4, ""padding_0"": ""same"", ""padding_1"": ""valid"", ""pool_0"": 4, ""pool_1"": 2}",PRUNED
94,0.3925201606074751,2026-09-16 14:54:14.273570,2026-09-16 14:54:29.064151,0 days 00:00:14.790581,32,24,32.0,32.0,4,same,valid,valid,same,2,2,1.0,1.0,2702176.0,0.047766403208448764,0.396341472864151,"{""filters_0"": 32, ""filters_1"": 24, ""n_conv_layers"": 4, ""padding_0"": ""same"", ""padding_1"": ""valid"", ""pool_0"": 2, ""pool_1"": 2}",COMPLETE
95,0.8955061851838455,2026-09-16 14:54:29.065270,2026-09-16 14:55:15.222568,0 days 00:00:46.157298,16,24,32.0,32.0,4,same,valid,valid,same,2,1,1.0,1.0,4286464.0,0.07577188449697582,0.9015679359436035,"{""filters_0"": 16, ""filters_1"": 24, ""n_conv_layers"": 4, ""padding_0"": ""same"", ""padding_1"": ""valid"", ""pool_0"": 2, ""pool_1"": 1}",COMPLETE
96,0.32435571273688574,2026-09-16 14:55:15.223163,2026-09-16 14:55:30.416967,0 days 00:00:15.193804,16,24,32.0,32.0,4,same,valid,valid,same,1,4,2.0,1.0,4705792.0,0.0831843514586365,0.33101046085357666,"{""filters_0"": 16, ""filters_1"": 24, ""n_conv_layers"": 4, ""padding_0"": ""same"", ""padding_1"": ""valid"", ""pool_0"": 1, ""pool_1"": 4}",COMPLETE
97,0.44255078683673427,2026-09-16 14:55:30.417507,2026-09-16 14:55:43.174103,0 days 00:00:12.756596,16,48,16.0,48.0,4,same,valid,valid,same,2,2,1.0,1.0,2434128.0,0.04302811493735973,0.445993036031723,"{""filters_0"": 16, ""filters_1"": 48, ""n_conv_layers"": 4, ""padding_0"": ""same"", ""padding_1"": ""valid"", ""pool_0"": 2, ""pool_1"": 2}",COMPLETE
98,,2026-09-16 14:55:43.174653,2026-09-16 14:55:43.223434,0 days 00:00:00.048781,16,24,32.0,,3,same,same,same,,4,2,4.0,,,,,"{""filters_0"": 16, ""filters_1"": 24, ""n_conv_layers"": 3, ""padding_0"": ""same"", ""padding_1"": ""same"", ""pool_0"": 4, ""pool_1"": 2}",PRUNED
99,0.3802245289466494,2026-09-16 14:55:43.223819,2026-09-16 14:55:54.822559,0 days 00:00:11.598740,16,24,48.0,32.0,4,valid,same,valid,same,2,2,1.0,1.0,2157280.0,0.03813426894233475,0.38327527046203613,"{""filters_0"": 16, ""filters_1"": 24, ""n_conv_layers"": 4, ""padding_0"": ""valid"", ""padding_1"": ""same"", ""pool_0"": 2, ""pool_1"": 2}",COMPLETE
