number,value,datetime_start,datetime_complete,duration,params_filters_0,params_filters_1,params_filters_2,params_filters_3,params_n_conv_layers,params_padding_0,params_padding_1,params_padding_2,params_padding_3,params_pool_0,params_pool_1,params_pool_2,params_pool_3,user_attrs_macs,user_attrs_macs_ratio,user_attrs_val_accuracy,system_attrs_tpe:relative_params:0,state
0,0.10584737640189675,2026-09-16 13:55:07.870871,2026-09-16 13:55:26.665390,0 days 00:00:18.794519,32,48,,,2,valid,valid,,,1,2,,,15083376.0,0.2666290499806967,0.12717770040035248,,COMPLETE
1,,2026-09-16 13:55:26.666789,2026-09-16 13:55:27.075454,0 days 00:00:00.408665,48,16,24.0,24.0,4,same,valid,same,same,4,1,2.0,4.0,,,,,PRUNED
2,,2026-09-16 13:55:27.075942,2026-09-16 13:55:27.145069,0 days 00:00:00.069127,24,24,48.0,,4,same,same,same,,4,4,4.0,,,,,,PRUNED
3,0.7195287849392464,2026-09-16 13:55:27.145611,2026-09-16 13:56:09.475056,0 days 00:00:42.329445,24,32,,,2,valid,valid,,,2,2,,,1836160.0,0.032457826179799275,0.7221254110336304,,COMPLETE
4,0.7199369105606822,2026-09-16 13:56:09.475579,2026-09-16 13:57:21.246001,0 days 00:01:11.770422,32,32,,,2,valid,valid,,,1,1,,,10171168.0,0.1797958799829735,0.7343205809593201,,COMPLETE
5,,2026-09-16 13:57:21.247442,2026-09-16 13:57:21.342373,0 days 00:00:00.094931,16,32,32.0,,4,same,valid,same,,4,4,4.0,,,,,,PRUNED
6,0.3312109306929433,2026-09-16 13:57:21.342804,2026-09-16 13:57:32.520878,0 days 00:00:11.178074,24,48,,,2,same,same,,,4,1,,,1090176.0,0.01927105650563614,0.33275261521339417,,COMPLETE
7,,2026-09-16 13:57:32.521780,2026-09-16 13:57:32.584213,0 days 00:00:00.062433,24,48,16.0,24.0,4,valid,same,valid,valid,2,2,2.0,,,,,,PRUNED
8,0.31836421741097976,2026-09-16 13:57:32.584901,2026-09-16 13:57:56.050507,0 days 00:00:23.465606,48,24,,,2,valid,valid,,,4,4,,,934968.0,0.01652744250374399,0.3196864128112793,,COMPLETE
9,,2026-09-16 13:57:56.051919,2026-09-16 13:57:56.180463,0 days 00:00:00.128544,48,32,24.0,24.0,4,valid,same,valid,valid,2,1,4.0,4.0,,,,,PRUNED
10,0.7216226778461032,2026-09-16 13:57:56.180994,2026-09-16 13:59:14.889103,0 days 00:01:18.708109,32,32,,,2,valid,same,,,1,1,,,11442976.0,0.20227764791064765,0.7378048896789551,"{""filters_0"": 32, ""filters_1"": 32, ""n_conv_layers"": 2, ""padding_0"": ""valid"", ""padding_1"": ""same"", ""pool_0"": 1, ""pool_1"": 1}",COMPLETE
11,0.3842633785688083,2026-09-16 13:59:14.890767,2026-09-16 13:59:44.031304,0 days 00:00:29.140537,48,32,,,2,valid,same,,,1,1,,,17164384.0,0.3034150577048448,0.4085365831851959,"{""filters_0"": 48, ""filters_1"": 32, ""n_conv_layers"": 2, ""padding_0"": ""valid"", ""padding_1"": ""same"", ""pool_0"": 1, ""pool_1"": 1}",COMPLETE
12,0.10669474174900967,2026-09-16 13:59:44.031841,2026-09-16 14:00:01.204344,0 days 00:00:17.172503,32,32,16.0,,3,valid,valid,valid,,1,1,1.0,,14484176.0,0.2560369831417852,0.12717770040035248,"{""filters_0"": 32, ""filters_1"": 32, ""n_conv_layers"": 3, ""padding_0"": ""valid"", ""padding_1"": ""valid"", ""pool_0"": 1, ""pool_1"": 1}",COMPLETE
13,0.7754095288213801,2026-09-16 14:00:01.205947,2026-09-16 14:01:28.685450,0 days 00:01:27.479503,32,32,,,2,same,same,,,1,1,,,12830560.0,0.22680598982086822,0.7935540080070496,"{""filters_0"": 32, ""filters_1"": 32, ""n_conv_layers"": 2, ""padding_0"": ""same"", ""padding_1"": ""same"", ""pool_0"": 1, ""pool_1"": 1}",COMPLETE
14,0.684817204087646,2026-09-16 14:01:28.687115,2026-09-16 14:02:56.556145,0 days 00:01:27.869030,32,32,,,2,same,same,,,1,2,,,12830560.0,0.22680598982086822,0.7029616832733154,"{""filters_0"": 32, ""filters_1"": 32, ""n_conv_layers"": 2, ""padding_0"": ""same"", ""padding_1"": ""same"", ""pool_0"": 1, ""pool_1"": 2}",COMPLETE
15,0.26615078205586296,2026-09-16 14:02:56.560561,2026-09-16 14:03:11.919330,0 days 00:00:15.358769,32,32,32.0,,3,same,same,valid,,2,1,1.0,,5826400.0,0.10299335485686568,0.27439025044441223,"{""filters_0"": 32, ""filters_1"": 32, ""n_conv_layers"": 3, ""padding_0"": ""same"", ""padding_1"": ""same"", ""pool_0"": 2, ""pool_1"": 1}",COMPLETE
16,0.8011299511427786,2026-09-16 14:03:11.919828,2026-09-16 14:05:08.884112,0 days 00:01:56.964284,16,24,48.0,,3,valid,same,same,,1,1,2.0,,16817712.0,0.29728693187844435,0.8249129056930542,"{""filters_0"": 16, ""filters_1"": 24, ""n_conv_layers"": 3, ""padding_0"": ""valid"", ""padding_1"": ""same"", ""pool_0"": 1, ""pool_1"": 1}",COMPLETE
17,0.8011299511427786,2026-09-16 14:05:08.885967,2026-09-16 14:06:52.405387,0 days 00:01:43.519420,16,24,48.0,,3,valid,same,same,,1,1,2.0,,16817712.0,0.29728693187844435,0.8249129056930542,"{""filters_0"": 16, ""filters_1"": 24, ""n_conv_layers"": 3, ""padding_0"": ""valid"", ""padding_1"": ""same"", ""pool_0"": 1, ""pool_1"": 1}",COMPLETE
18,0.865866079398835,2026-09-16 14:06:52.407201,2026-09-16 14:08:04.195376,0 days 00:01:11.788175,16,24,48.0,,3,valid,same,same,,1,2,2.0,,7382832.0,0.1305064252410791,0.8763065934181213,"{""filters_0"": 16, ""filters_1"": 24, ""n_conv_layers"": 3, ""padding_0"": ""valid"", ""padding_1"": ""same"", ""pool_0"": 1, ""pool_1"": 2}",COMPLETE
19,0.8344350048421811,2026-09-16 14:08:04.196343,2026-09-16 14:09:09.541081,0 days 00:01:05.344738,16,16,48.0,,3,same,same,same,,1,2,2.0,,5586000.0,0.09874380067116087,0.842334508895874,"{""filters_0"": 16, ""filters_1"": 16, ""n_conv_layers"": 3, ""padding_0"": ""same"", ""padding_1"": ""same"", ""pool_0"": 1, ""pool_1"": 2}",COMPLETE
20,0.8386542070259554,2026-09-16 14:09:09.542320,2026-09-16 14:11:18.535660,0 days 00:02:08.993340,48,24,48.0,,3,same,same,same,,1,2,2.0,,18001680.0,0.3182159508890124,0.8641114830970764,"{""filters_0"": 48, ""filters_1"": 24, ""n_conv_layers"": 3, ""padding_0"": ""same"", ""padding_1"": ""same"", ""pool_0"": 1, ""pool_1"": 2}",COMPLETE
21,0.2768075335373385,2026-09-16 14:11:18.536412,2026-09-16 14:11:42.708816,0 days 00:00:24.172404,48,24,48.0,,3,same,same,same,,1,2,2.0,,18001680.0,0.3182159508890124,0.3022648096084595,"{""filters_0"": 48, ""filters_1"": 24, ""n_conv_layers"": 3, ""padding_0"": ""same"", ""padding_1"": ""same"", ""pool_0"": 1, ""pool_1"": 2}",COMPLETE
22,0.2357444883943046,2026-09-16 14:11:42.709564,2026-09-16 14:11:58.076412,0 days 00:00:15.366848,16,16,,,2,same,same,,,1,2,,,3304880.0,0.0584204103047093,0.24041812121868134,"{""filters_0"": 16, ""filters_1"": 16, ""n_conv_layers"": 2, ""padding_0"": ""same"", ""padding_1"": ""same"", ""pool_0"": 1, ""pool_1"": 2}",COMPLETE
23,0.8222398945211362,2026-09-16 14:11:58.077225,2026-09-16 14:13:02.977024,0 days 00:01:04.899799,16,16,48.0,,3,same,same,same,,1,2,2.0,,5586000.0,0.09874380067116087,0.8301393985748291,"{""filters_0"": 16, ""filters_1"": 16, ""n_conv_layers"": 3, ""padding_0"": ""same"", ""padding_1"": ""same"", ""pool_0"": 1, ""pool_1"": 2}",COMPLETE
24,0.8805665296735282,2026-09-16 14:13:02.977837,2026-09-16 14:13:39.384770,0 days 00:00:36.406933,16,24,48.0,,3,valid,same,same,,2,2,2.0,,1915440.0,0.033859259856349515,0.8832752704620361,"{""filters_0"": 16, ""filters_1"": 24, ""n_conv_layers"": 3, ""padding_0"": ""valid"", ""padding_1"": ""same"", ""pool_0"": 2, ""pool_1"": 2}",COMPLETE
25,0.6464013977141027,2026-09-16 14:13:39.385972,2026-09-16 14:14:13.942821,0 days 00:00:34.556849,16,24,,,2,valid,same,,,2,2,,,1189560.0,0.02102786887332369,0.6480836272239685,"{""filters_0"": 16, ""filters_1"": 24, ""n_conv_layers"": 2, ""padding_0"": ""valid"", ""padding_1"": ""same"", ""pool_0"": 2, ""pool_1"": 2}",COMPLETE
26,0.8974120975144744,2026-09-16 14:14:13.943431,2026-09-16 14:15:23.488426,0 days 00:01:09.544995,16,24,48.0,16.0,4,valid,same,same,same,1,2,2.0,1.0,7866512.0,0.1390564434130496,0.9085366129875183,"{""filters_0"": 16, ""filters_1"": 24, ""n_conv_layers"": 4, ""padding_0"": ""valid"", ""padding_1"": ""same"", ""pool_0"": 1, ""pool_1"": 2}",COMPLETE
27,0.25978139644941084,2026-09-16 14:15:23.489201,2026-09-16 14:15:38.952131,0 days 00:00:15.462930,16,24,48.0,16.0,4,valid,same,same,same,1,2,2.0,1.0,7866512.0,0.1390564434130496,0.27090591192245483,"{""filters_0"": 16, ""filters_1"": 24, ""n_conv_layers"": 4, ""padding_0"": ""valid"", ""padding_1"": ""same"", ""pool_0"": 1, ""pool_1"": 2}",COMPLETE
28,0.8988591951550956,2026-09-16 14:15:38.954861,2026-09-16 14:16:10.889675,0 days 00:00:31.934814,16,24,48.0,,3,valid,same,same,,2,2,2.0,,1915440.0,0.033859259856349515,0.9015679359436035,"{""filters_0"": 16, ""filters_1"": 24, ""n_conv_layers"": 3, ""padding_0"": ""valid"", ""padding_1"": ""same"", ""pool_0"": 2, ""pool_1"": 2}",COMPLETE
29,0.29314457843569713,2026-09-16 14:16:10.890364,2026-09-16 14:16:18.913795,0 days 00:00:08.023431,16,24,48.0,,3,valid,valid,same,,2,2,1.0,,1521456.0,0.02689479913962437,0.29529616236686707,"{""filters_0"": 16, ""filters_1"": 24, ""n_conv_layers"": 3, ""padding_0"": ""valid"", ""padding_1"": ""valid"", ""pool_0"": 2, ""pool_1"": 2}",COMPLETE
30,0.12563231643439415,2026-09-16 14:16:18.914310,2026-09-16 14:16:26.599208,0 days 00:00:07.684898,16,16,24.0,,3,valid,same,same,,2,2,2.0,,1092792.0,0.019317299574478915,0.12717770040035248,"{""filters_0"": 16, ""filters_1"": 16, ""n_conv_layers"": 3, ""padding_0"": ""valid"", ""padding_1"": ""same"", ""pool_0"": 2, ""pool_1"": 2}",COMPLETE
31,0.38411093294244997,2026-09-16 14:16:26.600031,2026-09-16 14:16:41.047999,0 days 00:00:14.447968,32,24,48.0,,3,valid,same,same,,2,2,2.0,,3104880.0,0.05488500748798317,0.38850173354148865,"{""filters_0"": 32, ""filters_1"": 24, ""n_conv_layers"": 3, ""padding_0"": ""valid"", ""padding_1"": ""same"", ""pool_0"": 2, ""pool_1"": 2}",COMPLETE
32,0.8920495691458302,2026-09-16 14:16:41.048524,2026-09-16 14:17:12.472742,0 days 00:00:31.424218,16,24,48.0,,3,valid,same,same,,4,2,2.0,,571056.0,0.010094564954541791,0.8928571343421936,"{""filters_0"": 16, ""filters_1"": 24, ""n_conv_layers"": 3, ""padding_0"": ""valid"", ""padding_1"": ""same"", ""pool_0"": 4, ""pool_1"": 2}",COMPLETE
33,,2026-09-16 14:17:12.474408,2026-09-16 14:17:12.528075,0 days 00:00:00.053667,16,24,48.0,,3,valid,same,same,,4,4,2.0,,,,,"{""filters_0"": 16, ""filters_1"": 24, ""n_conv_layers"": 3, ""padding_0"": ""valid"", ""padding_1"": ""same"", ""pool_0"": 4, ""pool_1"": 4}",PRUNED
34,,2026-09-16 14:17:12.528509,2026-09-16 14:17:12.596510,0 days 00:00:00.068001,16,24,48.0,48.0,4,valid,valid,same,same,4,2,2.0,2.0,,,,"{""filters_0"": 16, ""filters_1"": 24, ""n_conv_layers"": 4, ""padding_0"": ""valid"", ""padding_1"": ""valid"", ""pool_0"": 4, ""pool_1"": 2}",PRUNED
35,0.8945719527831524,2026-09-16 14:17:12.596920,2026-09-16 14:17:51.234944,0 days 00:00:38.638024,16,24,32.0,,3,same,same,same,,2,2,2.0,,1867264.0,0.033007652025856524,0.897212564945221,"{""filters_0"": 16, ""filters_1"": 24, ""n_conv_layers"": 3, ""padding_0"": ""same"", ""padding_1"": ""same"", ""pool_0"": 2, ""pool_1"": 2}",COMPLETE
36,0.31692741562607757,2026-09-16 14:17:51.235434,2026-09-16 14:17:58.660385,0 days 00:00:07.424951,16,24,,,2,same,same,,,2,1,,,1335000.0,0.023598813801646933,0.31881532073020935,"{""filters_0"": 16, ""filters_1"": 24, ""n_conv_layers"": 2, ""padding_0"": ""same"", ""padding_1"": ""same"", ""pool_0"": 2, ""pool_1"": 1}",COMPLETE
37,0.3068406181556112,2026-09-16 14:17:58.660895,2026-09-16 14:18:08.641301,0 days 00:00:09.980406,16,48,32.0,,3,same,same,same,,2,2,2.0,,3539968.0,0.06257606419160186,0.31184670329093933,"{""filters_0"": 16, ""filters_1"": 48, ""n_conv_layers"": 3, ""padding_0"": ""same"", ""padding_1"": ""same"", ""pool_0"": 2, ""pool_1"": 2}",COMPLETE
38,0.913603268438204,2026-09-16 14:18:08.641818,2026-09-16 14:18:48.775439,0 days 00:00:40.133621,16,24,32.0,32.0,4,same,same,same,same,2,2,1.0,1.0,2576896.0,0.045551826884051516,0.9172474145889282,"{""filters_0"": 16, ""filters_1"": 24, ""n_conv_layers"": 4, ""padding_0"": ""same"", ""padding_1"": ""same"", ""pool_0"": 2, ""pool_1"": 2}",COMPLETE
39,0.9009822977583208,2026-09-16 14:18:48.777125,2026-09-16 14:19:20.555553,0 days 00:00:31.778428,16,24,32.0,,3,same,same,valid,,2,2,1.0,,1646080.0,0.029097779342782758,0.9033101201057434,"{""filters_0"": 16, ""filters_1"": 24, ""n_conv_layers"": 3, ""padding_0"": ""same"", ""padding_1"": ""same"", ""pool_0"": 2, ""pool_1"": 2}",COMPLETE
40,0.9091066184572696,2026-09-16 14:19:20.556085,2026-09-16 14:19:58.588128,0 days 00:00:38.032043,16,24,32.0,32.0,4,same,same,valid,same,2,2,1.0,1.0,2060800.0,0.036428790623546065,0.9120209217071533,"{""filters_0"": 16, ""filters_1"": 24, ""n_conv_layers"": 4, ""padding_0"": ""same"", ""padding_1"": ""same"", ""pool_0"": 2, ""pool_1"": 2}",COMPLETE
41,0.12371516596115206,2026-09-16 14:19:58.588723,2026-09-16 14:20:10.355304,0 days 00:00:11.766581,16,24,32.0,32.0,4,same,same,valid,same,2,1,1.0,1.0,5528320.0,0.09772419049881706,0.13153310120105743,"{""filters_0"": 16, ""filters_1"": 24, ""n_conv_layers"": 4, ""padding_0"": ""same"", ""padding_1"": ""same"", ""pool_0"": 2, ""pool_1"": 1}",COMPLETE
42,0.9123584774363924,2026-09-16 14:20:10.356150,2026-09-16 14:20:49.445683,0 days 00:00:39.089533,16,24,32.0,32.0,4,same,valid,valid,same,2,2,1.0,1.0,1609216.0,0.028446133895603798,0.9146341681480408,"{""filters_0"": 16, ""filters_1"": 24, ""n_conv_layers"": 4, ""padding_0"": ""same"", ""padding_1"": ""valid"", ""pool_0"": 2, ""pool_1"": 2}",COMPLETE
43,0.89755012067446,2026-09-16 14:20:49.446582,2026-09-16 14:21:19.838236,0 days 00:00:30.391654,16,24,32.0,32.0,4,same,valid,valid,same,2,2,1.0,1.0,1609216.0,0.028446133895603798,0.8998258113861084,"{""filters_0"": 16, ""filters_1"": 24, ""n_conv_layers"": 4, ""padding_0"": ""same"", ""padding_1"": ""valid"", ""pool_0"": 2, ""pool_1"": 2}",COMPLETE
44,0.9066802065755918,2026-09-16 14:21:19.838733,2026-09-16 14:22:03.161968,0 days 00:00:43.323235,16,32,32.0,32.0,4,same,same,valid,same,2,2,1.0,1.0,2544640.0,0.044981637117769924,0.9102787375450134,"{""filters_0"": 16, ""filters_1"": 32, ""n_conv_layers"": 4, ""padding_0"": ""same"", ""padding_1"": ""same"", ""pool_0"": 2, ""pool_1"": 2}",COMPLETE
45,0.35408298136294364,2026-09-16 14:22:03.162520,2026-09-16 14:22:18.307246,0 days 00:00:15.144726,32,24,32.0,32.0,4,same,same,valid,same,2,2,1.0,1.0,3395680.0,0.06002548318350296,0.3588850200176239,"{""filters_0"": 32, ""filters_1"": 24, ""n_conv_layers"": 4, ""padding_0"": ""same"", ""padding_1"": ""same"", ""pool_0"": 2, ""pool_1"": 2}",COMPLETE
46,0.9166357991788133,2026-09-16 14:22:18.308092,2026-09-16 14:23:02.469308,0 days 00:00:44.161216,16,48,32.0,32.0,4,same,same,valid,same,2,2,1.0,1.0,3512320.0,0.06208733010621764,0.9216027855873108,"{""filters_0"": 16, ""filters_1"": 48, ""n_conv_layers"": 4, ""padding_0"": ""same"", ""padding_1"": ""same"", ""pool_0"": 2, ""pool_1"": 2}",COMPLETE
47,0.4450077515031889,2026-09-16 14:23:02.469858,2026-09-16 14:23:16.119312,0 days 00:00:13.649454,16,32,32.0,32.0,4,same,same,valid,same,2,2,1.0,1.0,2544640.0,0.044981637117769924,0.4486062824726105,"{""filters_0"": 16, ""filters_1"": 32, ""n_conv_layers"": 4, ""padding_0"": ""same"", ""padding_1"": ""same"", ""pool_0"": 2, ""pool_1"": 2}",COMPLETE
48,0.28336052871677725,2026-09-16 14:23:16.120003,2026-09-16 14:23:29.490762,0 days 00:00:13.370759,16,48,32.0,32.0,4,same,same,valid,same,2,2,1.0,1.0,3512320.0,0.06208733010621764,0.28832751512527466,"{""filters_0"": 16, ""filters_1"": 48, ""n_conv_layers"": 4, ""padding_0"": ""same"", ""padding_1"": ""same"", ""pool_0"": 2, ""pool_1"": 2}",COMPLETE
49,0.22590591108526908,2026-09-16 14:23:29.493237,2026-09-16 14:23:52.150305,0 days 00:00:22.657068,48,16,32.0,32.0,4,same,same,valid,same,2,2,1.0,1.0,3486400.0,0.061629141901169936,0.23083624243736267,"{""filters_0"": 48, ""filters_1"": 16, ""n_conv_layers"": 4, ""padding_0"": ""same"", ""padding_1"": ""same"", ""pool_0"": 2, ""pool_1"": 2}",COMPLETE
50,0.5158306537175638,2026-09-16 14:23:52.151015,2026-09-16 14:24:08.136604,0 days 00:00:15.985589,16,24,32.0,32.0,4,same,same,valid,same,4,2,1.0,1.0,509056.0,0.00899859008135669,0.5165505409240723,"{""filters_0"": 16, ""filters_1"": 24, ""n_conv_layers"": 4, ""padding_0"": ""same"", ""padding_1"": ""same"", ""pool_0"": 4, ""pool_1"": 2}",COMPLETE
51,0.8714492530020732,2026-09-16 14:24:08.137833,2026-09-16 14:25:35.781167,0 days 00:01:27.643334,24,24,32.0,32.0,4,same,valid,valid,same,1,2,1.0,1.0,10210480.0,0.18049079876062918,0.8858885169029236,"{""filters_0"": 24, ""filters_1"": 24, ""n_conv_layers"": 4, ""padding_0"": ""same"", ""padding_1"": ""valid"", ""pool_0"": 1, ""pool_1"": 2}",COMPLETE
52,,2026-09-16 14:25:35.781871,2026-09-16 14:25:35.856415,0 days 00:00:00.074544,16,24,32.0,32.0,4,same,same,valid,same,2,4,1.0,2.0,,,,"{""filters_0"": 16, ""filters_1"": 24, ""n_conv_layers"": 4, ""padding_0"": ""same"", ""padding_1"": ""same"", ""pool_0"": 2, ""pool_1"": 4}",PRUNED
53,0.6639594391824255,2026-09-16 14:25:35.856904,2026-09-16 14:26:13.070257,0 days 00:00:37.213353,16,24,,,2,same,valid,,,2,2,,,1093080.0,0.019322390554535003,0.6655052304267883,"{""filters_0"": 16, ""filters_1"": 24, ""n_conv_layers"": 2, ""padding_0"": ""same"", ""padding_1"": ""valid"", ""pool_0"": 2, ""pool_1"": 2}",COMPLETE
54,0.8750567903835704,2026-09-16 14:26:13.073556,2026-09-16 14:26:59.945864,0 days 00:00:46.872308,16,24,16.0,32.0,4,same,same,valid,same,2,2,4.0,1.0,1499776.0,0.02651156147429126,0.8771777153015137,"{""filters_0"": 16, ""filters_1"": 24, ""n_conv_layers"": 4, ""padding_0"": ""same"", ""padding_1"": ""same"", ""pool_0"": 2, ""pool_1"": 2}",COMPLETE
55,0.8806669364203096,2026-09-16 14:26:59.947234,2026-09-16 14:29:05.568499,0 days 00:02:05.621265,24,48,32.0,32.0,4,same,same,valid,valid,1,2,1.0,1.0,19707568.0,0.34837095709010896,0.9085366129875183,"{""filters_0"": 24, ""filters_1"": 48, ""n_conv_layers"": 4, ""padding_0"": ""same"", ""padding_1"": ""same"", ""pool_0"": 1, ""pool_1"": 2}",COMPLETE
56,0.4491075693829406,2026-09-16 14:29:05.570629,2026-09-16 14:29:25.000082,0 days 00:00:19.429453,48,24,32.0,48.0,4,same,valid,valid,same,2,4,1.0,1.0,3341328.0,0.05906470211402947,0.453832745552063,"{""filters_0"": 48, ""filters_1"": 24, ""n_conv_layers"": 4, ""padding_0"": ""same"", ""padding_1"": ""valid"", ""pool_0"": 2, ""pool_1"": 4}",COMPLETE
57,0.917598087165611,2026-09-16 14:29:25.002226,2026-09-16 14:30:49.134299,0 days 00:01:24.132073,48,48,24.0,32.0,4,same,valid,valid,same,2,2,1.0,1.0,6527680.0,0.11538989129343419,0.9268292784690857,"{""filters_0"": 48, ""filters_1"": 48, ""n_conv_layers"": 4, ""padding_0"": ""same"", ""padding_1"": ""valid"", ""pool_0"": 2, ""pool_1"": 2}",COMPLETE
58,0.3461695199945142,2026-09-16 14:30:49.136910,2026-09-16 14:31:15.412911,0 days 00:00:26.276001,48,48,24.0,32.0,4,same,valid,valid,same,2,2,1.0,1.0,6527680.0,0.11538989129343419,0.3554007112979889,"{""filters_0"": 48, ""filters_1"": 48, ""n_conv_layers"": 4, ""padding_0"": ""same"", ""padding_1"": ""valid"", ""pool_0"": 2, ""pool_1"": 2}",COMPLETE
59,0.6126808484509333,2026-09-16 14:31:15.413561,2026-09-16 14:31:32.411542,0 days 00:00:16.997981,16,32,24.0,32.0,4,same,valid,valid,same,2,2,4.0,1.0,1627648.0,0.028771956619193278,0.6149826049804688,"{""filters_0"": 16, ""filters_1"": 32, ""n_conv_layers"": 4, ""padding_0"": ""same"", ""padding_1"": ""valid"", ""pool_0"": 2, ""pool_1"": 2}",COMPLETE
60,0.8836185747127432,2026-09-16 14:31:32.412249,2026-09-16 14:32:09.141388,0 days 00:00:36.729139,16,16,24.0,32.0,4,valid,valid,valid,same,2,2,1.0,1.0,989152.0,0.017485253834851434,0.8850173950195312,"{""filters_0"": 16, ""filters_1"": 16, ""n_conv_layers"": 4, ""padding_0"": ""valid"", ""padding_1"": ""valid"", ""pool_0"": 2, ""pool_1"": 2}",COMPLETE
61,0.8890639989248172,2026-09-16 14:32:09.143302,2026-09-16 14:33:43.949805,0 days 00:01:34.806503,16,48,32.0,32.0,4,same,valid,valid,same,1,2,1.0,1.0,13769728.0,0.24340767578376346,0.9085366129875183,"{""filters_0"": 16, ""filters_1"": 48, ""n_conv_layers"": 4, ""padding_0"": ""same"", ""padding_1"": ""valid"", ""pool_0"": 1, ""pool_1"": 2}",COMPLETE
62,0.39257066312963146,2026-09-16 14:33:43.951462,2026-09-16 14:33:56.928809,0 days 00:00:12.977347,16,48,16.0,32.0,4,valid,same,valid,same,2,2,1.0,2.0,2666464.0,0.04713512168149415,0.396341472864151,"{""filters_0"": 16, ""filters_1"": 48, ""n_conv_layers"": 4, ""padding_0"": ""valid"", ""padding_1"": ""same"", ""pool_0"": 2, ""pool_1"": 2}",COMPLETE
63,0.8730490607017051,2026-09-16 14:33:56.929814,2026-09-16 14:34:31.698082,0 days 00:00:34.768268,16,32,32.0,,3,same,valid,valid,,2,2,1.0,,1687552.0,0.02983088047085909,0.8754355311393738,"{""filters_0"": 16, ""filters_1"": 32, ""n_conv_layers"": 3, ""padding_0"": ""same"", ""padding_1"": ""valid"", ""pool_0"": 2, ""pool_1"": 2}",COMPLETE
64,0.21071080759249025,2026-09-16 14:34:31.699058,2026-09-16 14:34:53.427324,0 days 00:00:21.728266,48,16,32.0,,3,same,valid,valid,,2,2,1.0,,2527936.0,0.04468636027451696,0.2142857164144516,"{""filters_0"": 48, ""filters_1"": 16, ""n_conv_layers"": 3, ""padding_0"": ""same"", ""padding_1"": ""valid"", ""pool_0"": 2, ""pool_1"": 2}",COMPLETE
65,0.5522724155135045,2026-09-16 14:34:53.427887,2026-09-16 14:35:16.153345,0 days 00:00:22.725458,48,48,24.0,,3,valid,valid,valid,,2,2,1.0,,5538360.0,0.0979016677202167,0.5601045489311218,"{""filters_0"": 48, ""filters_1"": 48, ""n_conv_layers"": 3, ""padding_0"": ""valid"", ""padding_1"": ""valid"", ""pool_0"": 2, ""pool_1"": 2}",COMPLETE
66,0.7826641392115498,2026-09-16 14:35:16.154001,2026-09-16 14:36:35.352053,0 days 00:01:19.198052,48,24,,,2,same,same,,,2,2,,,4004760.0,0.07079219892156073,0.7883275151252747,"{""filters_0"": 48, ""filters_1"": 24, ""n_conv_layers"": 2, ""padding_0"": ""same"", ""padding_1"": ""same"", ""pool_0"": 2, ""pool_1"": 2}",COMPLETE
